id,name,genres,description,requirements,eeeeeeeeeeee,gay
3328350,'Galactic Sex Odyssey: NSFW Sci-Fi Porn',"[['Indie', 'RPG']]","Galactic Sex Odyssey is an Adult Visual Novel focusing on exploring the final frontier. The game is packed with sex, romance, and sexy aliens.","{'PC': 'Minimum:Requires a 64-bit processor and operating systemOS *: Windows 7 or higherProcessor: 2.0 GHz Core 2 DuoMemory: 2 GB RAMGraphics: DirectX or OpenGL compatible cardStorage: 2 GB available space', 'Mac': 'Minimum:OS: Mac OS X 10.6-10.14Processor: 1 GhzMemory: 512 MB RAMGraphics: DirectX or OpenGL compatible cardStorage: 2 GB available spaceAdditional Notes: Game is non-notarized. May not work with 10.15 Catalina', 'Linux': 'Minimum:OS: Ubuntu / SteamOSProcessor: 1 GhzMemory: 512 MB RAMGraphics: DirectX or OpenGL compatible cardStorage: 2 GB available space'}"
3328360,'Contract of Zerg Hunter Demo',"[['Action', 'Casual', 'Indie']]","In this survival game, players become contractors bound by mysterious forces, tasked with hunting dangerous Zerg. Battle to upgrade attributes, unlock contract powers, and buy weapons to craft your fighting style. Face relentless insect swarms and bosses in solo or 2-player co-op. Can you prevail?","{'PC': 'Minimum:OS: windows7+Memory: 4 GB RAMNetwork: Broadband Internet connectionStorage: 200 MB available space', 'Mac': '', 'Linux': ''}"
3328370,'Contract of Zerg Hunter Playtest',"[[]]","","{'PC': '', 'Mac': '', 'Linux': ''}"
3328380,'Negative Reverie',"[['Adventure', 'Indie', 'RPG']]","Bring down a futuristic tech company and discover the dark secrets behind their power. To survive, you'll have to give up on outsmarting your enemy and embrace the mindless animal inside.","{'PC': 'Minimum:OS: Windows 10Processor: ╮ (. ❛ ᴗ ❛.) ╭Graphics: ╮ (. ❛ ᴗ ❛.) ╭Sound Card: ╮ (. ❛ ᴗ ❛.) ╭', 'Mac': '', 'Linux': ''}"
3328390,'Gyroban',"[['Casual', 'Indie']]","Spin and shake entire Sokoban-like levels to solve puzzles, avoid obstacles, and interact with unique objects that transform gameplay and add new layers of challenge.","{'PC': 'Minimum:Requires a 64-bit processor and operating systemOS: Windows 10Processor: Requires a 64-bit processor and operating systemGraphics: Support for OpenGL 3.3Storage: 150 MB available space', 'Mac': 'Minimum:', 'Linux': 'Minimum:'}"
3328410,'Slumbering Feline',"[['Adventure', 'Casual', 'Free To Play']]","Slumbering Feline is a single-player, one-shot game featuring a feline-themed story. Step into the shoes of Momo, who finds herself lost in a strange dream and trying to escape from her slumber. Can Momo find her way out of this dreamscape?","{'PC': 'Minimum:OS: Windows 10/11Processor: 2.8 GHz or equivalentMemory: 4 GB RAMGraphics: NVIDIA GeForce GTX750 Ti or equivalentStorage: 1 GB available space', 'Mac': '', 'Linux': 'Minimum:OS: Ubuntu 20.04.6, Debian 12.8.0Processor: 2.8 GHz or equivalentMemory: 4 GB RAMGraphics: NVIDIA GeForce GTX750 Ti or equivalentStorage: 1 GB available space'}"
3328500,'Shadows of Truth VR',"[['Action', 'Adventure', 'Indie', 'Strategy']]","As a detective you need to find clues and plotted them in your mind and got close to the answers, but things took different turn someone is chasing you in your nightmares and it keeps coming! Back in reality someone else is also trying to reach to John. You need to escape and get to the answers!","{'PC': 'Minimum:Requires a 64-bit processor and operating systemOS: Windows 11Processor: i3-10100 or higherMemory: 8 GB RAMGraphics: RTX 2060DirectX: Version 12Storage: 5 GB available spaceVR Support: OpenXR on Meta with Meta Quest 2Additional Notes: This is a VR only game and a VR headset is required!', 'Mac': 'Minimum:', 'Linux': 'Minimum:'}"
3328510,'Hangul Typing Tale Demo',"[[]]","","{'PC': '', 'Mac': '', 'Linux': ''}"
3328520,'MATH',"[['Action', 'Adventure']]","&quot;MATH&quot; is a fun, educational game that combines adventure with learning. Players embark on thrilling quests to save friendly creatures by solving puzzles that require multiplication skills. With increasing challenges, Perfect for learning in an engaging, indirect way!","{'PC': 'Minimum:Requires a 64-bit processor and operating systemOS: win 10Processor: ci5Graphics: vga 2 gbStorage: 1 GB available space', 'Mac': 'Minimum:', 'Linux': 'Minimum:'}"
3328530,'HARCA',"[['Indie', 'Free To Play', 'Early Access']]","HARCA is an accessible rhythm game platform where players can upload their own music, create custom charts, and compete on global leaderboards. With just five keys, players can immerse themselves in unique songs and daily updated rankings.","{'PC': 'Minimum:OS: Windows8.1/10Processor: 3GHz以上Memory: 8 GB RAMStorage: 1 GB available space', 'Mac': 'Minimum:OS: mac OS 11 Big SurProcessor: Apple M1Memory: 8 GB RAM', 'Linux': ''}"
3328540,'Librarian Lust',"[['Adventure', 'Casual', 'Indie', 'RPG', 'Simulation']]","Bridget and Vera arrive at the famous Roxburial Library, hoping to uncover secrets about goblins for their research. However, the enigmatic librarian, Elor Dophner, has other plans.","{'PC': 'Minimum:Requires a 64-bit processor and operating systemOS: Windows 10Processor: Intel Core 2 Duo E4700Memory: 2 GB RAMGraphics: Intel HD 4000Storage: 1 GB available space', 'Mac': 'Minimum:OS: Version 10.11+Processor: Intel Core 2 Duo E4700Memory: 2 GB RAMStorage: 1 GB available space', 'Linux': 'Minimum:OS: Steam OS or Ubuntu 16.04Processor: Intel Core 2 Duo E4700Memory: 2 GB RAMStorage: 1 GB available space'}"
3328560,'Ways of Alchemy Playtest',"[[]]","","{'PC': '', 'Mac': '', 'Linux': ''}"
3328570,'Crabs Dive In Crossway Demo',"[[]]","&quot;Crabs Dive In Crossway&quot; is a Sokoban-like puzzle game. You need to command a troop of crabs and manage them to the target places. Crabs are stubborn and cooperative! Each will only move in horizontal/vertical line. They can carry another to change line, and push away single crab in the way.","{'PC': '', 'Mac': '', 'Linux': ''}"
3328610,'大荒图志录',"[['Casual', 'Indie', 'Massively Multiplayer', 'RPG', 'Free To Play']]","It is a multiplayer online role-playing game (MMORPG) that combines multiple gameplay, allowing you to experience the fun of hanging up easily in the cultivation world.","{'PC': 'Minimum:OS: Processor: Memory: 1 GB RAMNetwork: Broadband Internet connectionStorage: 1 GB available space', 'Mac': '', 'Linux': ''}"
3328630,'Icekai',"[['Adventure', 'Indie', 'RPG', 'Strategy']]","Icekai is a sokoban -style game in a slippery environment. Easy to learn but probably too hard for you to master.","{'PC': 'Minimum:OS: Windows 11 HomeProcessor: Intel Core i5Memory: 8 GB RAMGraphics: GeForce RTX 30 SeriesStorage: 1 GB available spaceSound Card: -VR Support: -Additional Notes: -', 'Mac': '', 'Linux': ''}"
3328670,'咏唱魔女 witch's Aria',"[['Indie', 'RPG', 'Strategy']]","&quot;Witch's Area&quot; is an RPG game with a core gameplay mechanic centered around combining cards to create spells, featuring light strategic roguelike elements. Combine different cards to craft your unique spells and uncover the truth behind the little witch's cyclical dreams!","{'PC': 'Minimum:OS: windows11Processor: core12 I5+Memory: 16 GB RAMGraphics: gtx1060', 'Mac': '', 'Linux': ''}"
3328680,'星海的流言',"[['Action', 'Indie']]","XingHaiDeLiuYan is a bullet-screen shooting game that features random enemy ships and bullet-screens, but also has a focus on strengthening the player's game content. Players can acquire three types of aircraft and 18 types of weapons to challenge increasingly powerful enemies.","{'PC': 'Minimum:Requires a 64-bit processor and operating systemOS *: Windows 7+Processor: Intel Core i5 7500Memory: 4 GB RAMGraphics: NVIDIA GeForce GTX 1060 6GBStorage: 600 MB available space', 'Mac': 'Minimum:', 'Linux': 'Minimum:'}"
3328690,'SHOOPER NOVA Playtest',"[[]]","","{'PC': '', 'Mac': '', 'Linux': ''}"
3328720,'Flash Doll',"[['Action', 'Casual', 'Indie', 'Strategy']]","Surprise blind boxes and custom outfits combined with physics-driven action figures, automatic battles, custom moves, and intense showdowns ready to start!","{'PC': 'Minimum:Requires a 64-bit processor and operating systemOS: Windows 10,11Processor: 2.0 GhzGraphics: GTX 1060/RX 580DirectX: Version 11Storage: 2 GB available spaceAdditional Notes: Recommend storing the application in a solid-state drive (SSD).', 'Mac': 'Minimum:', 'Linux': 'Minimum:'}"
3328730,'Autogun Heroes: Supercharged',"[['Action', 'Adventure', 'Casual']]","Blast your way through alien-infested planets and help Gus rescue powerful heroes, one by one, to save the galaxy. This challenging 2D action platformer combines intense shoot-'em-up chaos with smooth, responsive controls. Dodge. Roll. Dominate!","{'PC': 'Minimum:Requires a 64-bit processor and operating systemOS: 64-bit Windows 10Processor: 2.8 GHz Dual Core CPUMemory: 4 GB RAMGraphics: GeForce GTX 650, Radeon R7 370 or equivalent with 2 GB of video RAMDirectX: Version 11Storage: 500 MB available spaceSound Card: DirectX compatibleAdditional Notes: A keyboard, mouse, or controller is required for gameplay.', 'Mac': 'Minimum:', 'Linux': 'Minimum:'}"
3328740,'I Can't Handle My Body',"[['Casual', 'Indie', 'Early Access']]","Embark on a poignant journey with Jung Eun Yi, a fairy drone toy that gains consciousness and the ability to feel pain. Help her escape the harsh human world and find peace through the fireplace.","{'PC': 'Minimum:OS: Windows 10 64-bitProcessor: Intel Core i3-8100 or AMD Ryzen 3 1300XMemory: 8 GB RAMGraphics: NVIDIA GeForce GTX 960 or AMD Radeon R9 280 (3GB VRAM)DirectX: Version 11Storage: 1 GB available space', 'Mac': '', 'Linux': ''}"
3328760,'Sex-Loving Family - MOTION DLC -',"[['Adventure']]","Enjoy new scenes with added motion animation.","{'PC': '', 'Mac': '', 'Linux': ''}"
3328770,'Blueberry Tales',"[['Adventure', 'Indie', 'Free To Play']]","Dive into the captivating adventure of Blueberry Tales, a narrative game combining exploration and legendary mysteries!","{'PC': 'Minimum:OS *: Windows 7, 8, 10, 11Processor: 3.0 GHz P4, Dual Core 2.0 (or higher) or AMD64X2 (or higher)Memory: 2 GB RAMGraphics: ATI Radeon X800 (or higher) or NVIDIA GeForce 7600 (or higher)Storage: 2 GB available space', 'Mac': '', 'Linux': ''}"
3327780,'Warframe: 1999 Cyte-09 Bullseye Bundle',"[['Action', 'RPG', 'Free To Play']]","Take aim as the sharpshooter Warframe, Cyte-09, along with his signature Weapons and Customizations.","{'PC': 'Minimum:OS *:Windows 7 64-Bit (32-bit not supported) Processor:Intel Core i7 860, Intel Core i5 750, or AMD FX-4100 (SSE 4.2 support required) Video:DirectX 11+ capable Graphics Card Memory:4 GB RAM Storage:50 GB available HD space Internet:Broadband Internet Connection RequiredNote: There is no Mac or Linux client currently available.', 'Mac': '', 'Linux': ''}"
3327800,'Warframe: 1999 Complete Collection',"[['Action', 'RPG', 'Free To Play']]","The complete value for Tenno. Take aim as the sharpshooter Warframe, Cyte-09, and instantly add all the Gemini Skins to your Arsenal!","{'PC': 'Minimum:OS *:Windows 7 64-Bit (32-bit not supported) Processor:Intel Core i7 860, Intel Core i5 750, or AMD FX-4100 (SSE 4.2 support required) Video:DirectX 11+ capable Graphics Card Memory:4 GB RAM Storage:50 GB available HD space Internet:Broadband Internet Connection RequiredNote: There is no Mac or Linux client currently available.', 'Mac': '', 'Linux': ''}"
3327820,'Escape Camp Stranded',"[['Adventure', 'Indie']]","Single player horror game with puzzle elements. Solve the puzzles and Escape Camp Stranded.","{'PC': 'Minimum:Storage: 4 GB available space', 'Mac': '', 'Linux': ''}"
3327880,'Star Leap',"[['Action', 'Indie']]","Star Leap is a 2D platformer with a minimalistic aesthetic and gameplay that puts speed and flow first. Take advantage of momentum and master the recoil of your shots to reach insane speeds and beat each level as fast as posible!","{'PC': 'Minimum:OS: Windows 10 64-bitProcessor: Intel Core i3-3220 CPU @ 3.30GHzMemory: 8 GB RAMGraphics: Intel HD GraphicsDirectX: Version 11Storage: 200 MB available space', 'Mac': '', 'Linux': ''}"
3327890,'Hidden Bloodhunt Playtest',"[[]]","","{'PC': '', 'Mac': '', 'Linux': ''}"
3327900,'Void Grimm Clicker',"[['Free To Play']]","Void Grimm Clicker is an upcoming idle game in which you manage a scifi colony.","{'PC': 'Minimum:OS: Windows 10Processor: i7-5600u 2.6GHzMemory: 4 GB RAMGraphics: NVIDIA GeForce GT 1060DirectX: Version 11Storage: 1 GB available space', 'Mac': '', 'Linux': ''}"
3327910,'Trigonomis',"[['Free To Play']]","Modify your own machine to dominate the game","{'PC': 'Minimum:OS *: Windows 7, 8/8.1, 10Processor: Intel i5Memory: 512 MB RAMStorage: 100 MB available space', 'Mac': 'Minimum:OS: OSX 10.13Processor: 1.5Ghz or better (64 bit)Memory: 512 MB RAMGraphics: MetalStorage: 100 MB available space', 'Linux': 'Minimum:Memory: 512 MB RAMStorage: 100 MB available space'}"
3327920,'Love Spell: Sergio's Story (DLC)',"[['Casual', 'Indie', 'Simulation']]","Love Spell: Sergio's Story is the second DLC for Love Spell featuring Sergio, The Black Lion. It features the story and ability to romance Sergio, a mysterious stranger whose arrival beckons an unusual snowfall into Pastoria Town... along with dark secrets.❄️🦁","{'PC': '', 'Mac': '', 'Linux': ''}"
3327940,'Maid Coser Airi-chan',"[[]]","","{'PC': '', 'Mac': '', 'Linux': ''}"
3327950,'冷战：前线  Cold War Frontline',"[['Action', 'Strategy', 'Free To Play']]","Join this multiplayer cooperative PVE tank shooting game, drive famous vehicles from the Cold War, and have the opportunity to fight side by side with players around the world. Now, start the engine, the order will come later!","{'PC': 'Minimum:OS: Windows 10 (64bit)Processor: Intel Core i3 or betterMemory: 4 GB RAMGraphics: GeForce GTX 1660 Ti 6GB and higherDirectX: Version 12Network: Broadband Internet connectionStorage: 10 GB available space', 'Mac': '', 'Linux': ''}"
3327970,'Escape Camp Stranded Demo',"[[]]","Escape Camp Stranded is a single player horror game set at night, in an abandoned campground. This is a game about a man who becomes stranded at a strange cabin site. The road he arrived on is unfinished ahead and has become blocked behind. He must search the cabin site and find a way out of this strange place.","{'PC': 'Minimum:Requires a 64-bit processor and operating systemOS: Windows 10Processor: Ryzen 3 3600Memory: 16 GB RAMGraphics: GTX 1050Storage: 4 GB available space', 'Mac': 'Minimum:', 'Linux': 'Minimum:'}"
3327980,'Fight Life: Vanguard Prologue',"[['Indie', 'RPG', 'Strategy', 'Free To Play']]","Take on the mantle of leadership and engage in tactical turn-based combat, manage and upgrade each character, and strive to reclaim harmony in a world on the brink of oblivion in the free prologue version.","{'PC': 'Minimum:OS: Windows 10 / 11Processor: Intel Core i3-2100 / AMD Phenom II X4 965Memory: 2 GB RAMGraphics: Nvidia 8800 GT 512MB / Radeon HD 6570 1024MBDirectX: Version 11Storage: 1 GB available space', 'Mac': '', 'Linux': ''}"
3328010,'PORADORA vs Monsters of the World',"[['Action', 'Adventure', 'Indie']]","PORADORA vs. Monsters of the World is a thrilling 2.5D action-adventure platformer! Explore the world’s most iconic locations, uncover hidden mythological secrets, and take down monstrous foes in style. Jump, shoot, slide, and conquer! Adventure awaits! Are you ready? LET'S GO!","{'PC': 'Minimum:OS: Windows 10Processor: Intel Core i3-2100 ｜ AMD Phenom II X4 965Memory: 6 GB RAMGraphics: NVIDIA GeForce GTX 650 Ti, 2GB ｜ AMD Radeon HD 7790, 2GBStorage: 3 GB available space', 'Mac': '', 'Linux': ''}"
3328020,'Weird Wormholes',"[['Casual', 'Indie']]","Weird Wormholes is a casual game about traveling through wormholes to try and get back home. Use your ship to mine planets for resources and process these resources into components to enable your travels.","{'PC': 'Minimum:Requires a 64-bit processor and operating systemOS: Microsoft 64bit Windows 10Processor: 2 GhzMemory: 16 GB RAMGraphics: Intel HD Onboard GraphicsStorage: 200 MB available space', 'Mac': 'Minimum:', 'Linux': 'Minimum:OS: Ubuntu 22.04Processor: 2 GhzMemory: 16 MB RAMGraphics: OpenGL 4-compliant onboard graphicsStorage: 200 MB available space'}"
3328030,'The Texas Chain Saw Massacre - Summer Time Outfit Pack',"[['Action', 'Indie']]","Beat the Texas heat while making sure to avoid getting beaten by the Family in these summertime outfits! This DLC pack gives each Victim one brand new themed outfit. Stay cool and alive!","{'PC': 'Minimum:Requires a 64-bit processor and operating system', 'Mac': 'Minimum:', 'Linux': 'Minimum:'}"
3328040,'Horse Evolutions',"[['Action']]","You are a Horse. As a Horse with a freeform camera, it is you -vs- the world, surviving the elements &amp; avoiding being captured. Increase your herd through your offspring, extending your lineage. Either play casually, exploring vast environments or go deep into the story &amp; see how your Horse evolves.","{'PC': 'Minimum:Requires a 64-bit processor and operating systemOS: Windows 10 - 64-bitProcessor: Intel® Core™ i5-2500K / AMD FX-6300Memory: 8 MB RAMGraphics: Nvidia GeForce GTX 770 2GB or an AMD Radeon R9 280 3GBStorage: 75 MB available spaceSound Card: Direct X Compatible', 'Mac': 'Minimum:', 'Linux': 'Minimum:'}"
3328080,'Souper Game Demo',"[[]]","","{'PC': 'Minimum:OS *: Windows 7Processor: Intel Celeron CPU 1005MGraphics: Intel HD GraphicsDirectX: Version 10Storage: 500 MB available space', 'Mac': '', 'Linux': ''}"
3328090,'Cuckold Sex - Episode 7',"[['Adventure', 'Casual', 'Indie']]","An erotic VISUAL NOVEL featuring HD graphics, steamy ANIMATIONS, and realistic-looking characters. A physical checkup spirals into a steamy affair when Lily reveals the secrets of her open marriage to the charming and insatiable Doctor Martin. Will James catch them in the act?","{'PC': 'Minimum:OS: Windows 10Processor: 2 GHz Dual CoreMemory: 1 GB RAMGraphics: Graphics card supporting DirectX 9.0cDirectX: Version 9.0cStorage: 1 GB available spaceSound Card: Any', 'Mac': '', 'Linux': ''}"
3328130,'Fantasy Grounds - Cyberpunk RED - Tales of the RED: Hope Reborn',"[['Indie', 'RPG', 'Strategy']]","Cyberpunk RED - Tales of the RED: Hope RebornWhen the Megacorps blast your eyeballs with an unending bombardment of neon advertisements and the media outlets force-feed their version of reality into your bleeding ears, it can be easy to forget the truth about the world, the city, and your life.","{'PC': '', 'Mac': '', 'Linux': ''}"
3328200,'Sorcery Slam Playtest',"[[]]","","{'PC': '', 'Mac': '', 'Linux': ''}"
3328220,'Quadruped Match Demo',"[['Indie', 'Simulation']]","Your quadruped robot has an incredible ability to navigate the most challenging terrains. Just give it a target, and win the race!","{'PC': 'Minimum:OS: Windows 10Processor: Intel Core i3, AMD Ryzen 3Memory: 4 GB RAMGraphics: Nvidia GeForce gtx 750DirectX: Version 11Storage: 2 GB available space', 'Mac': '', 'Linux': ''}"
3328230,'Lyra Convolution',"[['Action', 'Indie', 'Free To Play']]","Lyra Convolution : The Future of Gaming is Here","{'PC': 'Minimum:Requires a 64-bit processor and operating systemOS: Windows 10Processor: Intel Core i3-10100FMemory: 8 GB RAMGraphics: GT 1030 2GBDirectX: Version 10Storage: 4 GB available space', 'Mac': 'Minimum:', 'Linux': 'Minimum:'}"
3328240,'Palpus X Annihilation Demo',"[[]]","An isometric brutal horde shooter with light RPG elements. Kill tons of aliens, find over a dozen weapons, skill up your character &amp; unveil the secrets of an abandoned research lab!","{'PC': 'Minimum:OS: Windows 10Memory: 300 MB RAM', 'Mac': '', 'Linux': ''}"
3328250,'There's no Santa - The Extra Presents',"[['Casual', 'Indie', 'Free To Play']]","Enjoy the 5 extra festive levels","{'PC': '', 'Mac': '', 'Linux': ''}"
3328260,'女王蟻のPerfume エピソード０-切り裂きジャックの狂愛-/Queen Ant Perfume Episode0-The Mad Love of Jack the Ripper-',"[['Adventure', 'Casual', 'Free To Play']]","A visual novel game set in “London at the end of the 19th century” and “modern Tokyo”. The game depicts a love episode between you and a male suspect that “Watson-kun,” the assistant of a famous detective (you), witnesses while investigating a threatening letter sent by Jack the Ripper.","{'PC': 'Minimum:OS: Windows 10 or HigherProcessor: Intel Core 2 DUO or HigherMemory: 2 GB RAMGraphics: VRAM512MB HigherStorage: 2 GB available space', 'Mac': 'Minimum:OS: Mac OS 10.4 and newerProcessor: 1GhzMemory: 2 MB RAMStorage: 2 MB available space', 'Linux': ''}"
3328270,'Desecrated Deck',"[['Casual', 'Indie', 'RPG', 'Strategy']]","Desecrated Deck is a dark and occult-inspired card game set in the basement of a cursed house where every move is the difference between life and death. With the help of powerful Item and Perk cards, you forge spiritual pacts to put a stop to malicious souls...","{'PC': 'Minimum:Requires a 64-bit processor and operating systemOS: Windows 10 / Windows 11 - 64 BitProcessor: Quad-Core Intel / AMD, 2,5 GHz or fasterMemory: 8 GB RAMGraphics: GeForce GTX 770 or Radeon HD 7970DirectX: Version 11Storage: 8 GB available spaceSound Card: Onboard Sound', 'Mac': 'Minimum:', 'Linux': 'Minimum:'}"
3327290,'Hamster Playground - Adventure & Style DLC Pack',"[['Casual', 'Indie', 'Racing', 'Simulation', 'Free To Play']]","Enhance your Hamster Playground with the Adventure &amp; Style DLC Pack! Includes six themes - Spooky House, Hamster City, Kawaii, Doll House, Royal Hamsters, and Cute Pets - with new decorations, costumes, and quests. Let your hamsters explore new adventures in style!","{'PC': '', 'Mac': '', 'Linux': ''}"
3327300,'Juxtapose',"[['Casual', 'RPG']]","This game captivates players with its stunning palace settings, meticulously crafted visuals that transport you to the splendor of ancient times.","{'PC': 'Minimum:OS: Windows 10Processor: Intel Core i3-2125 / AMD A10-7850KMemory: 4 GB RAMGraphics: Intel HD 3000 / AMD Radeon R7 GraphicsStorage: 4 GB available space', 'Mac': '', 'Linux': ''}"
3327310,'Mitigate',"[['Casual', 'RPG']]","This game captivates every player with its warm animated style, featuring soft yet vivid colors that create a world both dreamy and lifelike.","{'PC': 'Minimum:OS: Windows 10Processor: Intel Core i3-2125 / AMD A10-7850KMemory: 4 GB RAMGraphics: Intel HD 3000 / AMD Radeon R7 GraphicsStorage: 4 GB available space', 'Mac': '', 'Linux': ''}"
3327320,'New SEXY Gallery! - Beach Boys: Zodiac Date',"[['Casual', 'Indie', 'Simulation']]","Add style, attitude, and power to your game: 12 unique characters await you in this DLC to take the fun to the next level.","{'PC': '', 'Mac': '', 'Linux': ''}"
3327330,'Low poly stories: mist Demo',"[['Action', 'Adventure', 'Indie', 'RPG']]","Low Poly Stories: Mist (Demo) is an action-adventure game that invites you to experience Chapter 1 of its dark fantasy world. Embark on an exciting journey filled with exploration, combat, and survival as you take your first steps in uncovering the mystery behind the mist that engulfs your home","{'PC': 'Minimum:Requires a 64-bit processor and operating systemOS: Windows 10, 11Processor: intel core I5Memory: 4 GB RAMGraphics: GTX 1050 TiDirectX: Version 11Storage: 2 GB available spaceSound Card: default', 'Mac': 'Minimum:', 'Linux': 'Minimum:'}"
3327340,'The battle for Christmas',"[['Action', 'Adventure', 'Casual', 'Indie']]","It's just another boring steam platformer from a piss-poor developer, mind you. Gameplay will take you an hour, but you will get 90 achievements","{'PC': 'Minimum:OS *: Windows 7 and upProcessor: 1Ghz and upMemory: 4 GB RAMStorage: 500 MB available space', 'Mac': 'Minimum:OS: Yosemite 10.10.5 or newerProcessor: Apple Silicon or IntelMemory: 4 GB RAMGraphics: Integrated works fineStorage: 500 MB available space', 'Linux': 'Minimum:OS: Latest Debian redistributable or SteamOSProcessor: 1Ghz and upMemory: 4 GB RAMGraphics: Dedicated video card recommendedStorage: 500 MB available space'}"
3327350,'Low poly stories: mist Playtest',"[[]]","","{'PC': '', 'Mac': '', 'Linux': ''}"
3327360,'踏月尋歌',"[['Adventure', 'Indie', 'RPG', 'Simulation']]","　　《踏月尋歌》是一款古風戀愛文字冒險遊戲，劇情描述女主秦歌得到天書的過程以及自身血脈的秘密，與五位男主之間都有著錯綜複雜的關係，每個人的故事都是一環扣著一環，隨著劇情發展你將會慢慢發覺真相。","{'PC': 'Minimum:Requires a 64-bit processor and operating systemOS: Win7 以上Storage: 2 GB available space', 'Mac': 'Minimum:', 'Linux': 'Minimum:'}"
3327370,'Apricity',"[['Action', 'Indie', 'Strategy', 'Free To Play']]","Apricity is a top-down shooter party game for 1-4 players. 11 character classes. Arcade-style gameplay with a text-adventure driven roguelike mode and a score attack endless mode.","{'PC': 'Minimum:OS *: Windows 7Storage: 10 MB available space', 'Mac': '', 'Linux': ''}"
3327380,'午前五時にピアノを弾く ENCORE',"[['Adventure', 'Indie']]","朝の早い時間、午前五時くらいになると、この町にはときどき濃い霧が出る──。","{'PC': 'Minimum:OS: Windows 10 or Higher', 'Mac': '', 'Linux': ''}"
3327400,'The Shattered Veil',"[['Indie', 'RPG']]","The Wraith Army rises again, and it falls to Kael to wear the Crown and lead his people to victory once more. After spending the last decade preparing for Coronation Day with the help of his sister, Elara, they will soon discover that the Wraith Army is much closer than they had anticipated.","{'PC': 'Minimum:OS *: Windows XP/7/8/10Processor: 2 GHzMemory: 128 MB RAMGraphics: DirectX 9.0 or higherDirectX: Version 9.0Storage: 1000 MB available spaceSound Card: DirectX 9.0 Compatible Sound', 'Mac': '', 'Linux': ''}"
