id,name,genres,description,requirements,eeeeeeeeeeee,gay
2023920,'DYSCHRONIA: Chronos Alternate - Dual Edition',"[['Action', 'Adventure']]","Solve an impossible murder case in the far-flung future in this VR &amp; Non-VR investigation action adventure! Multi-awarded title DYSCHRONIA: Chronos Alternate - Dual Edition contains all three episodes from the acclaimed trilogy.","{'PC': 'Minimum:Requires a 64-bit processor and operating systemOS: Windows 10 or laterProcessor: Core 2 Duo or aboveMemory: 16 GB RAMGraphics: DirectX 11 or 12 compatibleDirectX: Version 11Storage: 10 GB available spaceVR Support: SteamVR-Meta Headset / Valve Index / HTC Vive', 'Mac': 'Minimum:', 'Linux': 'Minimum:'}"
2023960,'快乐小家 Home Sick',"[['Indie']]","This is a horror puzzle game. To be a successful player, use objects in the mystery house wisely, and find the meaning of this metaphoric story.","{'PC': 'Minimum:OS: anyProcessor: anyMemory: any MB RAMGraphics: anyStorage: any MB available spaceSound Card: anyAdditional Notes: any', 'Mac': '', 'Linux': ''}"
2023970,'Light Them Up',"[['Casual', 'Indie', 'Strategy']]","Light Them Up is an ambient PC puzzle game about constellations.","{'PC': 'Minimum:Requires a 64-bit processor and operating systemOS *: Windows 7 (64-bit)Processor: X64 Architecture/Dual Core+Memory: 2 GB RAMGraphics: 2 GB RAMDirectX: Version 10Storage: 1 GB available space', 'Mac': 'Minimum:', 'Linux': 'Minimum:'}"
2023980,'fault - StP - LIGHTKRAVTE Original Soundtrack',"[[]]","Official original soundtrack of fault - StP - LIGHTKRAVTE.","{'PC': '', 'Mac': '', 'Linux': ''}"
2023990,'Triopticon三昧',"[['Casual', 'Indie', 'RPG']]","The story of this visual novel begins with a winter night crime. Detective Yu-chi Fang discovered that the anomaly at the crime scene was related to his own hidden secret. What is abnormal and what is normal? In the end, Yu-chi Fang must face his true feelings and make a choice.","{'PC': 'Minimum:OS: Windows 10Processor: Intel Core i7Memory: 2 GB RAMStorage: 1 GB available space', 'Mac': '', 'Linux': ''}"
2024000,'Chester’s Revenge Demo',"[[]]","Rad Ralph took the Sacred Carrot and wiped out Chester's herd. Now Chester must get revenge. Takedown Rad Ralph's lieutenants one by one and crush them. Reclaim the Sacred Carrot and help the world's most badass guinea pig avenge this vile act of depravity.","{'PC': 'Minimum:OS: 7, 8.1, 10 64 bitProcessor: Intel Core2 Duo E7300 (2 * 2660) or AMD Athlon II X2 270 (2 * 3400) or equivalentMemory: 4 GB RAMGraphics: GeForce GT 640 (2048 MB) or Radeon HD 4850 (1024 MB)Storage: 1 GB available space', 'Mac': '', 'Linux': ''}"
2024010,'Chasing Halo:Iron Storm',"[['Free To Play', 'Massively Multiplayer', 'Simulation', 'Strategy']]","It is a team tactical competitive shooting game,which has forged vehicles, novel playing methods,exquisite pictures and shocking scenes. In the tripartite battle of virtual history, we will break through the siege,use exquisite strategies to sweep away thousands of troops and be the winner.","{'PC': 'Minimum:OS *: Windows7/8/10 64-bitProcessor: Intel Core i3-2120@3.3GHzMemory: 8 GB RAMGraphics: NVIDIA GeForce GTX 760 2GBDirectX: Version 11Network: Broadband Internet connectionStorage: 20 GB available space', 'Mac': '', 'Linux': ''}"
2024020,'Sometimes They Come Back Demo',"[[]]","Clear up the mysteries and horrors of the ominous Freedom Towers and try to salvage your life. Investigate, talk with the other residents to reveal their secrets, solve puzzles, cry, suffer... and try to play through the game — before the game plays through you.","{'PC': 'Minimum:OS *: Windows 8, 10, 11Memory: 4 GB RAMStorage: 2 GB available space', 'Mac': '', 'Linux': ''}"
2024030,'浮世渡り',"[['Action', 'Indie']]","「浮世渡り」は、広大なマップを駆け、消えた家族を探しに行くアクションRPGだ。 プレイヤーは、迫りくる敵に、強力で破壊的なコマンド技や、アイテムを駆使し、進み続けます。","{'PC': 'Minimum:Requires a 64-bit processor and operating systemOS: Windows10Processor: intel Core i7Memory: 200 MB RAMStorage: 1 GB available space', 'Mac': 'Minimum:', 'Linux': 'Minimum:'}"
2024050,'Hazel Sky Soundtrack',"[[]]","The Official Soundtrack of Hazel Sky brings life the true essence of Hazel Sky.","{'PC': '', 'Mac': '', 'Linux': ''}"
2024060,'Get Out Of My Space Demo',"[[]]","These damned people have been reigning in our part of space for too long. They kidnap our people and conduct experiments on them. We cannot afford to be treated like this.","{'PC': 'Minimum:OS *: Windows 7/8/10Processor: AMD Athlon X4 3.1 GHz / Intel Core i3 3 GHzMemory: 4 GB RAMGraphics: Radeon R7 260X (2 GB) / GeForce GTX 550 Ti (1 GB)DirectX: Version 10Storage: 10 GB available space', 'Mac': '', 'Linux': ''}"
2024070,'Party Quiz',"[['Casual', 'Indie', 'Simulation', 'Early Access']]","Play a local Quiz game with your friends. Create your own Quiz using the Party Quiz Constructor or use the Steam Workshop to download one of the Quizzes made by the community. A fun way to test your knowledge!","{'PC': 'Minimum:OS *: Microsoft® Windows® 7 (64 bit) or newerProcessor: 64 bit dual core processorMemory: 4 GB RAMGraphics: Compatible with Direct X 11.0Storage: 300 MB available spaceSound Card: Default', 'Mac': '', 'Linux': ''}"
2024080,'Hit and Boom',"[['Action', 'Strategy', 'Free To Play']]","Hit and Boom is a free-to-play game developed by combining MOBA &amp; Battle Royale game mechanics, where you look down on the battlefield and overwhelm your opponents with every skill shot you hit.","{'PC': 'Minimum:Requires a 64-bit processor and operating systemOS: Windows 10Processor: i5 6300 HQMemory: 8 GB RAMGraphics: GTX 760DirectX: Version 10Storage: 4 GB available space', 'Mac': 'Minimum:', 'Linux': 'Minimum:'}"
2024150,'恋爱关系/Romance - Final',"[['Casual', 'Simulation']]","Love sometimes has the bitterness of not being understood, But the unspoken words are always waiting to be heard. Would you like to build a future with me?","{'PC': 'Minimum:OS *: Windows7/8/10Processor: Intel Core i5Graphics: NVIDIA GefSound Card: DirectX 11 Sound Device', 'Mac': '', 'Linux': ''}"
2024160,'Highrise City: Metro & Planes',"[['Simulation', 'Strategy']]","Metro &amp; Planes is the first DLC for Highrise City and builds up on the successful formula to create realistic cities with complex economy structures. It will allow you to optimize your public transport systems and to increase your trading capacities.","{'PC': 'Minimum:OS: Windows 10Processor: Intel Core i7 7700 @ 3.6GhzMemory: 16 GB RAMGraphics: GeForce GTX 760 TiDirectX: Version 11Storage: 900 MB available space', 'Mac': '', 'Linux': ''}"
2024170,'Crowns and Pawns: Kingdom of Deceit Soundtrack',"[[]]","Legends of the past come back to life in this charming point-and-click adventure. Pack your bags and journey with Crowns and Pawns: Kingdom of Deceit through modern day Europe to uncover the secrets of the king who was never crowned.","{'PC': 'Minimum:Storage: 60 MB available space', 'Mac': '', 'Linux': ''}"
2024180,'The Block Demo',"[[]]","A short, timed demo for The Block, a minimalist city building toy. Place randomly generated buildings on a square and watch your tiny city block come to life!","{'PC': 'Minimum:Requires a 64-bit processor and operating system', 'Mac': 'Minimum:', 'Linux': 'Minimum:'}"
2023200,'Dogyuun',"[['Action']]","A science fiction-themed vertically scrolling shoot 'em up game known for its stunning detailed pixel art, gigantic bosses, and a menacing difficulty. From the legendary studio Toaplan, this is quite possibly the most rock and roll shooting game of all time.","{'PC': 'Minimum:Requires a 64-bit processor and operating systemMemory: 256 MB RAMStorage: 10 MB available space', 'Mac': 'Minimum:Memory: 256 MB RAMStorage: 10 MB available space', 'Linux': 'Minimum:Memory: 256 MB RAMStorage: 10 MB available space'}"
2023210,'Meteorites 3D',"[['Action', 'Casual', 'Indie', 'Simulation', 'Strategy']]","Experience the retro arcade shooter inspired game Meteorite 3D built for modern 3D rendering, being a spiritual successor to the space games of old","{'PC': 'Minimum:Requires a 64-bit processor and operating systemOS *: Windows 7Processor: 1GHz+ or higherMemory: 1 GB RAMGraphics: NVIDIA GeForce®️ GT 710Network: Broadband Internet connectionStorage: 500 MB available spaceAdditional Notes: If you cannot run the game, you must be running a potato', 'Mac': 'Minimum:', 'Linux': 'Minimum:'}"
2023230,'Scorn: Digital Artbook',"[['Action', 'Adventure', 'Indie']]","An in-depth look into Scorn's unique aesthetic. This 192-page digital artbook includes a curated collection of in-game art with never-before-seen imagery and concept designs.","{'PC': 'Minimum:OS: N/AProcessor: N/AGraphics: N/A', 'Mac': '', 'Linux': ''}"
2023240,'Scorn: Original Soundtrack',"[['Action', 'Adventure', 'Indie']]","Immerse yourself in the world of Scorn with the game's original soundtrack, composed by Aethek &amp; Lustmord.","{'PC': 'Minimum:Storage: 281 MB available spaceStorage (high-quality audio): Additional 916 MB available spaceAdditional Notes: MP3 + FLAC', 'Mac': '', 'Linux': ''}"
2023250,'Redaxium 2',"[['Indie', 'RPG']]","Appease God every 6 days or die! Find a way to break the cycle of ritual sacrifice.","{'PC': 'Minimum:OS: Windows 10Memory: 8 GB RAMStorage: 4 GB available space', 'Mac': '', 'Linux': 'Minimum:OS: Debian 10+Memory: 8 GB RAMStorage: 4 GB available spaceAdditional Notes: Proprietary drives may be necessary to use.'}"
2023260,'Cryweard Demo',"[[]]","","{'PC': 'Minimum:Requires a 64-bit processor and operating systemOS: Windows 10 64-bitProcessor: Intel Core i5-6400Memory: 16 GB RAMGraphics: NVIDIA GeForce GTX 950DirectX: Version 11Storage: 3 GB available space', 'Mac': 'Minimum:', 'Linux': 'Minimum:'}"
2023270,'Cryweard Playtest',"[[]]","","{'PC': 'Minimum:Requires a 64-bit processor and operating system', 'Mac': 'Minimum:', 'Linux': 'Minimum:'}"
2023310,'Unbelievaboom!',"[['Action', 'Casual', 'Indie', 'Sports', 'Free To Play']]","This title is an explosive soccer shooter based on the concept that explosions are fun. Use bombs and exploding bullets to blow up your surroundings and aim for the goal! In this title, you can blow up not only enemies and balls, but also yourself, goal posts, and everything else!","{'PC': 'Minimum:Requires a 64-bit processor and operating systemOS: Windows10 64bitProcessor: Core i7 7700KMemory: 8 GB RAMGraphics: \u200eNVIDIA GeForce GTX 1060Network: Broadband Internet connectionStorage: 2 GB available space', 'Mac': 'Minimum:', 'Linux': 'Minimum:'}"
2023330,'Fright Night',"[['Action', 'Indie']]","Fright Night is a single-player horror game, where you can feel the scary atmosphere and live through the story of the main protagonist.","{'PC': 'Minimum:OS: Windows 10Processor: Intel® Core™ i5-4590Memory: 2 GB RAMGraphics: NVIDIA GeForce GTX 960Storage: 3 GB available space', 'Mac': '', 'Linux': ''}"
2023350,'Non Fingo VR',"[['Simulation', 'Early Access']]","Non Fingo is a VR Space Combat Sim with n-body gravity, realistic(ish) physics, fully simulated projectiles, and 0g player movement in Early Access under active development by an independent, solo developer.","{'PC': 'Minimum:Requires a 64-bit processor and operating systemOS: 7 or higherProcessor: Intel Core i5-4590 / AMD FX 8350Memory: 4 GB RAMGraphics: GTX 970 / R9 290Storage: 4 GB available spaceVR Support: SteamVR or OpenXR', 'Mac': 'Minimum:', 'Linux': 'Minimum:'}"
2023360,'The Last Case of Benedict Fox Definitive Edition',"[['Action', 'Adventure', 'Indie', 'RPG']]","Take on the last case of Benedict Fox and dive into a twisted world of secret organizations, forbidden rituals, and cold-blooded murders. Explore the memories of deceased victims as you search for clues and fight demons in this fantastical Lovecraftian Metroidvania.","{'PC': 'Minimum:Requires a 64-bit processor and operating systemOS: Windows 10Processor: Intel Core i5-7400 3.00GHz or AMD Ryzen 5 1400 3.20GHzMemory: 12 GB RAMGraphics: NVIDIA GeForce 1050Ti or AMD equivalentDirectX: Version 11Storage: 8 GB available space', 'Mac': 'Minimum:', 'Linux': 'Minimum:'}"
2023370,'Escape Academy Season Pass',"[['Adventure']]","Continue your Escapist journey with the Escape Academy Season Pass! Includes: Escape from Anti-Escape Island (available Fall 2022) and Escape from the Past (available Spring 2023). Each includes FIVE escape rooms for a total of TEN brand new rooms in this Season Pass.","{'PC': 'Minimum:OS *: Windows 7Processor: x86, x64 architecture with SSE2 instruction set support.Graphics: Intel HD Graphics 3000', 'Mac': '', 'Linux': ''}"
2023380,'The Wasted Knight',"[['Action', 'Adventure', 'Indie']]","Take control of a knight too intoxicated to remember his own control scheme in this quirky, pixel, procedural, roguelite, where your control scheme constantly changes. Is jump A? Or X? How about RT? Who knows? The knight certainly doesn’t. *Controller required*","{'PC': 'Minimum:OS *: Windows 7+Processor: Intel i5+Memory: 2 GB RAMGraphics: Nvidia 450 GTS / Radeon HD 5750 or betterStorage: 500 MB available space', 'Mac': '', 'Linux': ''}"
2023390,'Non Fingo VR Playtest',"[[]]","","{'PC': 'Minimum:Requires a 64-bit processor and operating system', 'Mac': 'Minimum:', 'Linux': 'Minimum:'}"
2023420,'Operation Siege',"[['Action', 'Massively Multiplayer', 'Early Access']]","Operation Siege is an online multiplayer tactical FPS based on air combat, ground combat, with a selection of realistic faction-specific weapons and vehicles allow players to build their own loadouts for their preferred tactics. Prepare yourself for that operation.","{'PC': 'Minimum:Requires a 64-bit processor and operating systemAdditional Notes: TBA', 'Mac': 'Minimum:', 'Linux': 'Minimum:'}"
2023430,'Hermea',"[['Action', 'Racing']]","Hermea is an intern at Hermes' Delivery Service who transports mail by traversing perilous environments on foot and using a variety of abilities. Control Hermea to race against the clock and deliver timely as a faster time will reward a better score in this third person speedrunning platformer!","{'PC': 'Minimum:Requires a 64-bit processor and operating systemOS: Windows 10Processor: Intel i7-4790kMemory: 16 GB RAMGraphics: Nvidia GTX 970Storage: 4 GB available space', 'Mac': 'Minimum:', 'Linux': 'Minimum:'}"
2023440,'Jettatura',"[['Adventure', 'RPG']]","Jettatura is a challenging first-person dungeon-crawler (DRPG) with round-based combat. Form a band of up to six mercenaries to scout the subterrene world to reclaim a stolen ancient artifact from the surreptitious death-cult that pilfered it!","{'PC': 'Minimum:Requires a 64-bit processor and operating systemOS: Win10 (64-bit required)Processor: 1.8ghzMemory: 2 GB RAMGraphics: OpenGL 2.1+ ; Resolutions supported: 1920x1080, 1280x720Storage: 250 MB available space', 'Mac': 'Minimum:', 'Linux': 'Minimum:OS: Ubuntu 20.04 or Mint 20 (64-bit required)Processor: 1.8ghzMemory: 2 GB RAMGraphics: OpenGL 2.1+ ; Resolutions supported: 1920x1080, 1280x720Storage: 250 MB available space'}"
2023450,'Grindstone Soundtrack Volume 1',"[[]]","Listen. Grind. Repeat.","{'PC': 'Minimum:Storage: 75 MB available spaceStorage (high-quality audio): Additional 657 MB available space', 'Mac': '', 'Linux': ''}"
2023460,'Grindstone Soundtrack Volume 2',"[[]]","Listen. Grind. Repeat.","{'PC': 'Minimum:Storage: 105 MB available spaceStorage (high-quality audio): Additional 680 MB available space', 'Mac': '', 'Linux': ''}"
2023480,'Hermea Playtest',"[[]]","","{'PC': '', 'Mac': '', 'Linux': ''}"
2023490,'Backwater Playtest',"[[]]","","{'PC': 'Minimum:Requires a 64-bit processor and operating system', 'Mac': 'Minimum:', 'Linux': 'Minimum:'}"
2023500,'Deck of Life: No Turns, Individual Card Permadeath',"[['Indie', 'Strategy']]","A card battler where cards are your health. No turns, individual card permadeath. Construct defenses while launching projectiles to destroy your opponent's cards. Beat enemies and events to win cards from unique card pools. If all your cards on the field are destroyed, you die.","{'PC': 'Minimum:OS: Windows 11Processor: 2.0GHzMemory: 2048 MB RAMGraphics: DX9 compatible or betterStorage: 500 MB available spaceSound Card: Windows-based sound card', 'Mac': '', 'Linux': ''}"
2023530,'Color Story: Pixa's Quest',"[['Action', 'Adventure', 'Indie']]","In this challenging platformer you play as Pixa: run, jump, roll, and bounce through a magical but dangerous world held in the clutches of the evil wizard Earl Grey. Collect 12 special abilities across 21 sprawling levels, complete with split paths, secret items, and time attack challenges.","{'PC': 'Minimum:OS *: Windows 7Processor: 64bit Intel compatible Dual Core CPUMemory: 2 GB RAMGraphics: OpenGL 4-compliant onboard graphicsDirectX: Version 11Storage: 350 MB available space', 'Mac': '', 'Linux': ''}"
2023570,'Bullet Quest Demo',"[[]]","Combat Demo for Bullet Quest","{'PC': 'Minimum:OS *: Windows 7Processor: Intel i3 or betterGraphics: NVIDIA GeForce 6800+ / ATI Radeon X800+Storage: 500 MB available space', 'Mac': '', 'Linux': ''}"
2023610,'Terror Brain: Night Out',"[['Action', 'Adventure', 'Casual', 'Indie', 'Simulation']]","Terror Brain: Night Out is a Single-Player First-Person Action-Adventure Psychological Horror PC Game where you take on the role of university student Sarah Mitchell while she is trying to understand what happened to her after everything went dark during a night out at the local bar.","{'PC': 'Minimum:OS *: WINDOWS® 7, 8, 8.1, 10Processor: Intel® Core™ i3 or AMD Ryzen™ 3Memory: 4 GB RAMGraphics: NVIDIA® GeForce® GTX 950 or AMD Radeon™ R7 370DirectX: Version 10Storage: 4 GB available spaceAdditional Notes: ©2022 5PeaksCreative. All rights reserved.', 'Mac': '', 'Linux': ''}"
2023630,'Hidden Battle Top-Down 3D',"[['Action', 'Adventure', 'Casual', 'Indie', 'Simulation', 'Strategy']]","Find the objects that are hidden on the map.","{'PC': 'Minimum:OS *: Windows 7/8/10Processor: 3GHz Duo Core ProcessorMemory: 4 GB RAMGraphics: NVIDIA GeForce 450 or higher with 1GB MemoryStorage: 4 GB available space', 'Mac': 'Minimum:OS: Mac OS X 10.12+Processor: Intel Core i5Memory: 4 GB RAMGraphics: NVIDIA GeForce 450 or higher with 1GBStorage: 4 GB available space', 'Linux': 'Minimum:OS: Ubuntu 64-bit 16.04+Processor: Intel Core 2 Duo / AMD Phenom IIMemory: 4 GB RAMGraphics: NVIDIA GeForce 450 or higher with 1GBStorage: 4 GB available space'}"
2023640,'Hidden Industries Top-Down 3D',"[['Action', 'Adventure', 'Casual', 'Indie', 'Racing', 'Simulation', 'Sports', 'Strategy']]","Find the objects that are hidden on the map.","{'PC': 'Minimum:OS *: Windows 7/8/10Processor: 3GHz Duo Core ProcessorMemory: 4 GB RAMGraphics: NVIDIA GeForce 450 or higher with 1GB MemoryStorage: 4 GB available space', 'Mac': 'Minimum:OS: Mac OS X 10.12+Processor: Intel Core i5Memory: 4 GB RAMGraphics: NVIDIA GeForce 450 or higher with 1GBStorage: 4 GB available space', 'Linux': 'Minimum:OS: Ubuntu 64-bit 16.04+Processor: Intel Core 2 Duo / AMD Phenom IIMemory: 4 GB RAMGraphics: NVIDIA GeForce 450 or higher with 1GBStorage: 4 GB available space'}"
2023670,'Incoherence',"[['Adventure']]","Incoherence is a fragmented first-person point and click mystery game. Enter the mind of Jason Bethlam as you awake to a brightly lit room. Piece together fragments of your life and escape.","{'PC': 'Minimum:OS *: Windows 10, Windows 8, Windows 7, Vista, or XP Service Pack 3Processor: 1 GHzMemory: 1 GB RAMGraphics: OpenGL 2.1 or higher (available in most modern Windows systems)Storage: 2 GB available space', 'Mac': 'Minimum:OS: OSX 10.7+Processor: 1 GHzMemory: 1 GB RAMGraphics: EmbeddedStorage: 2 GB available space', 'Linux': ''}"
2023680,'ATurd - Abuser Escape',"[['Action', 'Adventure', 'Casual', 'Indie', 'Simulation']]","Evidence mode : Find evidences against your abuser. Ransack your house and avoid her at any cost! Cleaning Mode : Your agent is coming soon to sign your new movie contract ! Your Ex-Wife decided to make some Turds everywhere ! Time to clean !","{'PC': 'Minimum:Requires a 64-bit processor and operating systemOS: Windows® 10Processor: Intel® Core™ 2 Duo E6700, AMD Athlon X2 2.8 GHzMemory: 8 GB RAMGraphics: NVIDIA® GeForce® 8800 GTS, AMD Radeon HD 3850DirectX: Version 12Storage: 2 GB available space', 'Mac': 'Minimum:', 'Linux': 'Minimum:'}"
2022710,'The Guild 3 Soundtrack',"[[]]","The atmospheric Soundtrack to The Guild 3 features 25 high quality tracks for a total of nearly 1 hour of music, composed by Robin Birner and Yannick Süß from Audinity.","{'PC': 'Minimum:Storage: 132 MB available spaceStorage (high-quality audio): Additional 585 MB available space', 'Mac': '', 'Linux': ''}"
2022720,'Tilefinder Demo',"[[]]","Slay bizarre monsters and humans alike as you venture through the procedurally generated kingdom in this turn-based, rogue-like RPG. Explore the various characters and locations of the realm to find the legendary Tile shards, and seal the evil back beneath the castle!","{'PC': 'Minimum:OS: 10Processor: 2.3 GHz Intel Core 2 Duo or betterMemory: 512 MB RAMGraphics: DirectX 9 compatible video cardStorage: 512 MB available spaceSound Card: Any', 'Mac': '', 'Linux': ''}"
2022730,'REMEDIUM Demo',"[[]]","The fast-paced twin-stick shooter game in the grim post-apocalyptic Renaissance setting. It had been more than a hundred years since the terrible plague devoured the whole Europe and turned almost everyone there in the maddened mutants.","{'PC': 'Minimum:OS *: Windows 7 SP1/8.1/10 x64Processor: Intel Core i3-6300 or equivalent / AMD FX-8370 or equivalentMemory: 4 MB RAMGraphics: NVIDIA GeForce GT 630 or equivalent / AMD Radeon HD 5570 or equivalentDirectX: Version 11Storage: 7 MB available spaceSound Card: Direct X CompatibleAdditional Notes: Recommended Controllers: Xbox 360 Controller (Windows 7 SP1/8.1) Xbox One / Series Wireless Controller (Windows 10)', 'Mac': '', 'Linux': ''}"
2022740,'My Landlord is a Futanari',"[['Adventure']]","Rent is due, and having recently been laid off, you seem to have found yourself in quite the pickle.","{'PC': 'Minimum:OS *: Windows 7Processor: 1.2 GHz Pentium 4Memory: 400 MB RAMStorage: 200 MB available space', 'Mac': '', 'Linux': ''}"
2022750,'The Bridge Curse Road to Salvation The art of game Book',"[['Action', 'Adventure', 'RPG']]","The Making of The Bridge Curse: Road to Salvation is a production art book that offers an exclusive look on how the horror game was made. Its content includes developer interviews, concept art, game art, and other behind-the-scenes goodies that fans will enjoy.","{'PC': 'Minimum:OS *: Windows 7 / Windows 8 / 10 ( 64位)Processor: Intel Core i5 4590 or AMD equivalent (or better)Memory: 8 MB RAMGraphics: NVIDIA GTX 960 or equivalent (or better)Storage: 20 MB available space', 'Mac': '', 'Linux': ''}"
2022780,'FLASHOUT 3D: Enhanced Edition',"[['Action', 'Casual', 'Indie', 'Racing']]","The classical AG racer, FLASHOUT 3D, initially released more than 10 years ago, is back, to celebrate the upcoming launch of FLASHOUT 3! But we bring you not only the first installement of the series for FREE, but we have also remastered it and enhanced with upgraded graphics and new features!","{'PC': 'Minimum:Requires a 64-bit processor and operating systemOS *: Windows 7/8/10/11 64-bitProcessor: 3.2 GHz Dual Core ProcessorMemory: 8 GB RAMGraphics: GeForce GTX 780 or equivalent with 2 GB of video RAM. A dedicated video card is required.DirectX: Version 10Storage: 1 GB available spaceSound Card: DirectX compatibleAdditional Notes: Requires a 64-bit processor and operating system', 'Mac': 'Minimum:', 'Linux': 'Minimum:'}"
2022790,'Cazzarion: Demon Hunting Playtest',"[[]]","","{'PC': '', 'Mac': '', 'Linux': ''}"
2022800,'Aokana - Four Rhythms Across the Blue Piano Album #1',"[[]]","Featuring piano arrangements of 21 BGM tracks from Aokana: Four Rhythms Across the Blue, in addition to a vocal arrangement of Contrail. Includes True Colors ~Contrail~ (Vocal. KOTOKO).","{'PC': 'Minimum:Storage: 110 MB available spaceStorage (high-quality audio): Additional 810 MB available space', 'Mac': '', 'Linux': ''}"
2022830,'Super Space Arcade Playtest',"[[]]","","{'PC': 'Minimum:Requires a 64-bit processor and operating system', 'Mac': 'Minimum:', 'Linux': 'Minimum:'}"
2022840,'Zoria and the Cursed Land Demo',"[[]]","You play as Zoria Dunne, half orc adventurer (human/orc), eager to explore the world. Take your time exploring the ruins, forest and caves looking for your lost friends.","{'PC': 'Minimum:OS *: Windows 7+Processor: 1.2ghzMemory: 4 MB RAMGraphics: 512 mb Video MemoryStorage: 500 MB available spaceSound Card: AMD High Definition', 'Mac': '', 'Linux': ''}"
2022850,'Garlant: My Story',"[['Adventure', 'Casual', 'Indie', 'RPG', 'Simulation']]","I am a Falconeye who just graduated from the academy. In pursuit of challenges, I came to the distant border of the kingdom: Garlant in the Doe region. Here I will start a new chapter of my life, and it's going to be an amazing adventure story!","{'PC': 'Minimum:OS *: Windows 7 (SP1+)Processor: 1.6 GhzMemory: 512 MB RAMGraphics: 1 Gb dedicated video card, shader model 3.0+DirectX: Version 10Storage: 2 GB available space', 'Mac': '', 'Linux': ''}"
2022880,'Truxton',"[['Action']]","The ruthless Gidans invite you to an explosive space scramble! Head into the mighty Super Fighter and disintegrate your foes in all directions with various upgradeable weapons. Toaplan's no-frills vertical shooter Truxton speeds onto PC with new features and quality-of-life updates!","{'PC': 'Minimum:Requires a 64-bit processor and operating systemMemory: 256 MB RAMStorage: 10 MB available space', 'Mac': 'Minimum:Memory: 256 MB RAMStorage: 10 MB available space', 'Linux': 'Minimum:Memory: 256 MB RAMStorage: 10 MB available space'}"
