id,name,genres,description,requirements,eeeeeeeeeeee,gay
3320960,'The dead has risen',"[['Action', 'Indie']]","When the world is about to collapse under an epidemic Hope Brown decides to do something to change the fate of the city. Can you solve all the mysteries and defeat the people behind the Zombie project?","{'PC': 'Minimum:OS: Windows 10 (64-bit) or NewerProcessor: Intel Core i3Memory: 4 GB RAMGraphics: Nvidia GeForce GT 730Storage: 4 GB available space', 'Mac': '', 'Linux': ''}"
3321000,'The House of Toys',"[['Action', 'Adventure', 'Casual', 'Indie']]","The House of Toys is a horror game in which the player ventures into an old mansion filled with seemingly harmless toys. His mission is to explore each room, searching for clues to discover which of the toys is cursed. To free the soul trapped in this toy, the player must solve intricate puzzles.","{'PC': 'Minimum:Requires a 64-bit processor and operating systemOS: Windows 10 64 bitsProcessor: AMD Ryzen 3 3200G / Intel Core i5-7600KMemory: 8 GB RAMGraphics: AMD Radeon RX 580 8GB / NVIDIA GeForce GTX 1060 6GBDirectX: Version 11Storage: 4 GB available space', 'Mac': 'Minimum:', 'Linux': 'Minimum:'}"
3321010,'The Sintonia Chronicles',"[['Adventure', 'Casual', 'Indie']]","Join Maria on an unforgettable journey through the world of Sintonia to rescue her beloved pups. Forge unlikely alliances, face epic bosses, and outsmart every challenge in a universe brimming with magic and adventure.","{'PC': 'Minimum:Requires a 64-bit processor and operating systemOS: Windows 10 64-bitProcessor: Intel Core i3 2.4 GHz or AMD equivalentMemory: 8 GB RAMGraphics: NVIDIA GTX 970 or equivalentDirectX: Version 11Storage: 30 GB available spaceSound Card: OnboardVR Support: NoAdditional Notes: Compatible with standard Xbox controller', 'Mac': 'Minimum:', 'Linux': 'Minimum:'}"
3321020,'Fluff'n'Roll',"[['Action', 'Indie', 'Racing']]","Navigate tricky terrain, dodge obstacles, and roll your way to victory in Fluff’n’Roll! Master your skills to conquer increasingly challenging levels.","{'PC': 'Minimum:OS: Windows 10Processor: i7 -7700HQMemory: 8 GB RAMGraphics: NVIDIA® GeForce® GTX 1050Storage: 5 GB available spaceSound Card: Any', 'Mac': '', 'Linux': ''}"
3321050,'Ninja Cats',"[['Action', 'Adventure', 'Casual', 'Indie', 'Early Access']]","As a ninja cat, you must parkour across the map to collect croissants. BUT avoid falling into the water! Your cat hates that…  Play alone or with your friends and race for those croissants!","{'PC': 'Minimum:OS: Windows 10 or newerProcessor: 64-bit processorMemory: 4 GB RAMGraphics: GTX 700 series, R7 260X, equivalent or betterStorage: 2 GB available spaceAdditional Notes: These requirements are an estimation, the game might not run as intended on old hardware.', 'Mac': '', 'Linux': ''}"
3321080,'Guardians: A Wardens Tale',"[['RPG', 'Strategy']]","Guardians: A Wardens Tale is a Monster Taming/Dungeon crawling game. Progress through dungeons in each town to help the locals. Fight other Guardian tamers and Alpha Guardians in Active Time Battles with your team of 5.","{'PC': 'Minimum:OS: Windows 10 / Windows 11Memory: 16 MB RAM', 'Mac': '', 'Linux': ''}"
3321090,'Beach Outlet Simulator',"[['Action', 'Adventure', 'Casual', 'Indie', 'Simulation', 'Early Access']]","Run your retail company. Sign contracts with leading brands, order new products, meet customer needs, and never let your customers leave the store empty-handed. Hire new workers, expand your store, and enjoy the growth of your retail company.","{'PC': 'Minimum:Requires a 64-bit processor and operating systemOS: Windows 10 and Windows 11, 64-bit versions only.Processor: X64 architecture with SSE2 instruction set supportMemory: 8192 MB RAMGraphics: DX10, DX11, and DX12-capable GPUsDirectX: Version 10Storage: 4096 MB available space', 'Mac': 'Minimum:', 'Linux': 'Minimum:'}"
3321110,'Vasilisa And Baba Yaga Soundtrack',"[[]]","Original soundtrack of the game &quot;Vasilisa and Baba Yaga&quot;","{'PC': 'Minimum:Storage: 168 MB available spaceStorage (high-quality audio): Additional 707 MB available space', 'Mac': '', 'Linux': ''}"
3321120,'Ambulance Driver Life VR',"[['Casual', 'Indie', 'Simulation']]","Experience the intensity of emergency response in Ambulance Life, where you drive the ambulance and perform life-saving medical interventions in VR.","{'PC': 'Minimum:Requires a 64-bit processor and operating systemOS: Windows 10Processor: i5-4590 Equivalent or GreateerGraphics: NVIDIA GTX 970 Equivalent or GreaterVR Support: Oculus', 'Mac': 'Minimum:', 'Linux': 'Minimum:'}"
3321130,'Slime: The Cleaner Demo',"[['Casual', 'Indie']]","Demo of Slime The Cleaner! Join little Gooma as he strives to be the best cleaner in the Kingdom! Meet new friends, witness dubious things, and have a great time in this simple and cute game.","{'PC': 'Minimum:OS: Windows 10Processor: Intel i3Memory: 2 MB RAMStorage: 300 MB available space', 'Mac': '', 'Linux': ''}"
3321150,'Eternal Descent',"[['Action', 'Adventure']]","Descend to the gates of Hell and earn powers befitting a God. Delve into the Descent, explore procedurally generated caves to find and fight powerful demigods. Build a base and attract helpful NPCs to aid you in your quest. Die and retry in this unique combination of survival and roguelike.","{'PC': 'Minimum:Requires a 64-bit processor and operating systemOS: Windows 10Graphics: Something that can run pixel graphicsStorage: 500 MB available space', 'Mac': 'Minimum:', 'Linux': 'Minimum:'}"
3321180,'Undercover',"[['Action', 'Casual', 'Indie', 'Strategy', 'Free To Play']]","In Undercover, you enter a medieval world as a noble knight among trusted comrades. But beware—one of you is an infiltrator with a deadly mission. While you carry out your knightly duties, deception and danger lurk in the shadows. Can you unmask the traitor before they strike?","{'PC': 'Minimum:OS: Windows 10Processor: Intel Core i5-6600KMemory: 8 GB RAMGraphics: NVIDIA 1060, AMD RX56DirectX: Version 11Storage: 800 MB available space', 'Mac': '', 'Linux': ''}"
3321190,'T.I.O.S(MP)',"[['Adventure', 'Indie']]","In this multiplayer horror game (up to 4 players), survive the relentless monsters that track you down. Use items and monitor cameras to spot the creatures; every second counts. Teamwork and strategy are your only chances of survival… are you ready?","{'PC': 'Minimum:Requires a 64-bit processor and operating systemOS: Windows 10/11Processor: Ryzen 5 3600 , Intel core i5-11400Memory: 8 GB RAMGraphics: Nividia 1060 TI 6gbNetwork: Broadband Internet connectionStorage: 3 GB available spaceAdditional Notes: Headphones recommended for better audio experience', 'Mac': 'Minimum:', 'Linux': 'Minimum:'}"
3321200,'T.I.O.S(MP) Demo',"[[]]","Dans ce jeu d'horreur multijoueur (jusqu’à 4 joueurs), survivez aux apparitions de monstres. Utilisez l'environnement et surveillez les caméras pour repérer les créatures, mais faites vite : chaque seconde compte. Travail d’équipe et stratégie sont vos seules chances de survie… serez-vous prêts ?","{'PC': 'Minimum:Requires a 64-bit processor and operating systemOS: Windows 10/11Processor: Ryzen 5 3600, Intel core i5-11400Memory: 8 GB RAMGraphics: Nividia 1060 TINetwork: Broadband Internet connectionStorage: 3 GB available spaceAdditional Notes: Headphones recommended for better audio experience', 'Mac': 'Minimum:', 'Linux': 'Minimum:'}"
3321220,'Escape from Nightmare School',"[['Adventure', 'Casual', 'Indie']]","You have to escape the ghost-filled school... You only have three lives.","{'PC': 'Minimum:Requires a 64-bit processor and operating systemOS *: Windows 7,8,10 64bitProcessor: Intel Core TM i5 750Memory: 4 GB RAMGraphics: Radeon HD 5770 1GBDirectX: Version 11Storage: 250 MB available spaceAdditional Notes: Minimum resolution of 1280x720', 'Mac': 'Minimum:', 'Linux': 'Minimum:'}"
3321250,'Library of Meialia Demo',"[[]]","","{'PC': 'Minimum:OS *: Windows 7 or newerProcessor: Intel Dual CoreMemory: 4 GB RAMGraphics: Intel HD 4000DirectX: Version 11Storage: 500 MB available space', 'Mac': 'Minimum:OS: 64 bit macOSProcessor: 64 bit Intel CPU/Apple siliconMemory: 4 GB RAMStorage: 500 MB available space', 'Linux': ''}"
3321270,'World Below',"[['Action', 'Adventure', 'Casual', 'Indie', 'RPG', 'Strategy']]","Enter the mix between Roguelike and Autobattler games you never knew you wanted. Create unique teams and explore countless synergies and posibilities; finding rule-changing Relics, powerful items and unlocking new Units to aid you, as you delve deeper into the World Below.","{'PC': 'Minimum:OS *: Windows 7, 8, 10, 11 x64Processor: Intel Core i3Memory: 2 GB RAMGraphics: Integrated graphicsStorage: 1 GB available space', 'Mac': '', 'Linux': ''}"
3320280,'PARRYMAN Demo',"[[]]","","{'PC': '', 'Mac': '', 'Linux': ''}"
3320290,'DreamlessGirl - Skin Pack Rose-Hued Uniforms',"[['Action', 'Adventure', 'Casual', 'Indie', 'RPG']]","Doctor, Nurse, or Patient?Join the girls' doctor game now💉——The Rose-Hued Uniforms Character Skin Expansion Pack is officially released, available for purchase!","{'PC': 'Minimum:OS *: Windows 7Processor: intel i3-2100/AMD A8-5600kiMemory: 4 GB RAMGraphics: GeForce GTX 630/Radeon HD 6570DirectX: Version 11Network: Broadband Internet connectionStorage: 100 MB available space', 'Mac': '', 'Linux': ''}"
3320310,'Escape the Laser Trap',"[['Action', 'Indie']]","Step into deadly corridors filled with laser traps, relentless robots, and a terrifying alien humanoid. Dodge lasers, shoot robots, deactivate traps or use them to fight enemies. Explore the maze, find clues and escape.","{'PC': 'Minimum:OS: Windows 10/11Processor: core i5Memory: 8 GB RAMGraphics: gtx 2060', 'Mac': '', 'Linux': ''}"
3320320,'次元沙漏的棋盘 Dimensional Racing Board',"[['Casual', 'Indie', 'RPG', 'Strategy']]","It is a turn-based board fantasy role-playing game. You play as heroes from different dimensions to race against your friends on the board to see who reaches the finish line first. The rule is easy. The player who crosses the finish line first wins.","{'PC': 'Minimum:OS: Windows 10/11Processor: Intel Pentium 2.0GHz or higherMemory: 1024 MB RAMGraphics: Direct3D compatible video card with 128MB memory or moreDirectX: Version 12Network: Broadband Internet connectionStorage: 2 GB available spaceSound Card: DirectSound compatible sound card', 'Mac': '', 'Linux': ''}"
3320330,'Cursed Baby',"[['Adventure', 'Indie']]","The once #1 horror game on the Horror list of Itch is back! Join now and use a variety of repair tools to experience life as a handyman in a haunted house, uncover the terrifying past of this old house and face the terrifying demon baby head-on!","{'PC': 'Minimum:Requires a 64-bit processor and operating systemOS: WindowsProcessor: Intel Core I5 or AMD equivalentMemory: 8 GB RAMGraphics: NVIDIA GeForce GTX 960DirectX: Version 11Network: Broadband Internet connectionStorage: 2 GB available spaceSound Card: NVIDIA High Definition Audio', 'Mac': 'Minimum:', 'Linux': 'Minimum:'}"
3320340,'Nomadic Tale (Harvest Elysium)',"[['Action', 'Indie', 'RPG']]","Nomadic Tale is a 3D action-adventure game where you play as a backpacker working in orchards and mines. Explore maze-like fields, gather resources, and complete seasonal missions. Meet unique heroines each season, deepening your story. Enjoy nighttime events filled with romance and adventure!","{'PC': 'Minimum:Requires a 64-bit processor and operating systemOS: WIndows10 64bitProcessor: Intel Core i5 8th generationMemory: 16 MB RAMGraphics: NVIDIA GeForce 510Storage: 3 GB available space', 'Mac': 'Minimum:', 'Linux': 'Minimum:'}"
3320360,'The Patient - Prologue Playtest',"[[]]","","{'PC': '', 'Mac': '', 'Linux': ''}"
3320380,'Hangul Typing Tale',"[['Casual', 'Indie']]","Learning to type Korean 한글 from ZERO!","{'PC': 'Minimum:OS *: Windows Vista or greaterProcessor: 2 GhzMemory: 2 GB RAMGraphics: 256 mb video memory, shader model 3.0+DirectX: Version 10Storage: 400 MB available space', 'Mac': 'Minimum:OS: Mac OSX 10.10+Processor: 2 Ghz, Apple Silicon or IntelMemory: 2 GB RAMGraphics: 256 mb video memory, OpenGL 2Storage: 400 MB available space', 'Linux': ''}"
3320390,'Slug's Sister Defense',"[['Casual', 'Indie', 'Early Access']]","A spin-off from the asymmetric party action game &quot;Goonya Monster,&quot; with character designs by Terada Tera! Experience exhilarating roguelike tower-defense action! Defend the captive Snail from enemies approaching from all directions by acquiring and upgrading a variety of weapons and gear!","{'PC': 'Minimum:Requires a 64-bit processor and operating systemOS: Windows 10 64bitProcessor: Intel Core i5 or AMD equivalentMemory: 4 GB RAMGraphics: NVIDIA GTX 660 or AMD Radeon HD 7950Storage: 500 MB available space', 'Mac': 'Minimum:', 'Linux': 'Minimum:'}"
3320400,'Holdfast: Nations At War - Blackpowder Firearms',"[['Action', 'Indie', 'Massively Multiplayer', 'RPG', 'Simulation', 'Strategy']]","With valour and glory, march onto the battlefields of Holdfast with a brand new selection of firearms.","{'PC': 'Minimum:OS: Windows 10 64-bit or Windows 11 64-bitProcessor: 3 GHz Dual CoreMemory: 6 GB RAMGraphics: DirectX 11 Compatible CardDirectX: Version 11Network: Broadband Internet connectionStorage: 22 GB available space', 'Mac': '', 'Linux': ''}"
3320440,'CannonHead',"[['Action']]","CannonHead is a third-person action shooter inspired by 1920s and 1930s animations. Explore unique worlds, recruit companions, and discover new weapons to face powerful enemies.","{'PC': 'Minimum:OS *: Microsoft® Windows® 7 / 8 / 10 64 BitMemory: 2 GB RAMStorage: 4 GB available spaceSound Card: DirectX compatible', 'Mac': '', 'Linux': ''}"
3320490,'Row Hard',"[['Indie', 'Racing', 'Simulation', 'Sports', 'Strategy']]","Paddles, splashing of water and hard racing. Build your team, coach, mentor and lead them through tough choices to Olympic gold. Learn the price of victory! Deep story with resource management and rhythm sports races. What are you willing to sacrifice to win?","{'PC': 'Minimum:OS: 10, 11Processor: I3Graphics: GTX 750Storage: 5 GB available space', 'Mac': 'Minimum:OS: 13Processor: Apple M1 or Intel Core MMemory: 4 GB RAMStorage: 5 GB available space', 'Linux': ''}"
3320510,'Lines of Balls',"[['Casual', 'Indie']]","Remove the balls from the field by making lines. Make lines of five or more balls of the same color. The more balls in a line, the more points you get.","{'PC': 'Minimum:OS: Windows 10Processor: Intel Core i3 / AMD Ryzen 3Memory: 2 GB RAMGraphics: Nvidia GT 1030DirectX: Version 9.0Storage: 300 MB available spaceSound Card: DirectX compatible', 'Mac': '', 'Linux': ''}"
3320520,'cat lines',"[['Casual', 'Indie']]","Control a cute kitten that leaves a trail of yarn behind! Solve puzzles by covering all the blocks with the yarn line. A relaxing and challenging game for cat lovers!","{'PC': 'Minimum:OS *: Windows 7+Processor: Dual Core 2 GhzMemory: 4 GB RAMGraphics: 512 VRAMStorage: 400 MB available space', 'Mac': '', 'Linux': ''}"
3320530,'ととのいシミュレーター',"[['Indie', 'Simulation']]","The Totoi simulator is a simulator to feel “Totoi” by slowly soaking in a hot spring, taking a sauna, or bathing in a water bath, The Totoi Simulator is a simulator that allows you to feel “Totoi” by slowly soaking in a hot spring, taking a sauna, or taking a water bath.","{'PC': 'Minimum:OS: win10Processor: intel AMDMemory: 8 MB RAMGraphics: GPUStorage: 200 MB available space', 'Mac': '', 'Linux': ''}"
3320560,'BattleHeights Playtest',"[[]]","","{'PC': '', 'Mac': '', 'Linux': ''}"
3320590,'Vampire Therapist - Couples Therapy',"[['Indie', 'Simulation']]","You've helped the immortal undead live with themselves, but can you help them live with one another? Can vampires find domestic bliss? You'll need all your therapy skills to handle this couple in this expansion to the award-winning Vampire Therapist!","{'PC': 'Minimum:Requires a 64-bit processor and operating system', 'Mac': 'Minimum:', 'Linux': 'Minimum:'}"
3320600,'In The Night You Had Bad Dreams',"[['Indie', 'Free To Play']]","In the Night You Had Bad Dreams is a first-person horror game. You're trapped inside a strange house that seems to shift and change, waiting for you to solve unconventional puzzles. ","{'PC': 'Minimum:OS *: Windows 7 or higherProcessor: 2 Ghz or HigherMemory: 4 GB RAMGraphics: GeForce 970 or higherDirectX: Version 11Storage: 3 GB available spaceSound Card: Any sound card', 'Mac': '', 'Linux': ''}"
3320610,'Sexbot II: Recalibrated',"[['Adventure', 'Casual', 'Indie']]","The Sequel to Sexbot, now in development.","{'PC': 'Minimum:Requires a 64-bit processor and operating systemOS: Windows 10Processor: 1 GhzMemory: 512 MB RAMGraphics: DirectX or OpenGL compatible cardStorage: 4 GB available space', 'Mac': 'Minimum:OS: Apple Silicon or IntelProcessor: 1 GhzMemory: 512 MB RAMGraphics: DirectX or OpenGL compatible cardStorage: 4 GB available space', 'Linux': 'Minimum:Processor: 1 GhzMemory: 512 MB RAMGraphics: DirectX or OpenGL compatible cardStorage: 4 MB available space'}"
3320650,'Alaloth - Champions of The Four Kingdoms - Ultimate Pack',"[['Action', 'Adventure', 'Indie', 'RPG', 'Strategy']]","Alaloth: Champions of The Four Kingdoms - ULTIMATE PACK","{'PC': 'Minimum:Requires a 64-bit processor and operating system', 'Mac': 'Minimum:', 'Linux': 'Minimum:'}"
3320710,'Trials of Yarbil',"[['Action', 'Strategy', 'Free To Play']]","In this top-down roguelike you must think creatively to take advantage of your resources and best your enemies. You are a samurai wizard and to prove your worth you must complete the Trials of Yarbil.","{'PC': 'Minimum:OS: 10', 'Mac': '', 'Linux': ''}"
3320740,'Haven Digital Artbook',"[['Adventure', 'Indie', 'RPG']]","Discover Source through the eyes of Yu &amp; Kay in this digital version of Haven's artbook","{'PC': 'Minimum:OS *: Windows 7 or newerProcessor: Intel or AMD processor (1.5GHz or faster)Memory: 4 GB RAMStorage: 5 GB available space', 'Mac': '', 'Linux': ''}"
3320750,'Wingspan - Seasonal Decorative Pack 2',"[['Indie', 'Strategy']]","With the Seasonal Decorative Pack 2, you'll complete your collection with 6 backgrounds: 5 of them known from special events at Wingspan and one entirely new! Plus, each with a new matching player portrait available exclusively with this DLC.","{'PC': '', 'Mac': '', 'Linux': ''}"
3320770,'A Femboy Polished My Knob',"[['Adventure']]","One day while browsing a gay hookup app, you just so happen to find your type. What happens next will blow your mind... 💦","{'PC': 'Minimum:OS: Windows 10Processor: 1.2 GHz Pentium 4Memory: 400 MB RAMStorage: 200 MB available space', 'Mac': '', 'Linux': ''}"
3319780,'Encounter',"[['Adventure', 'Casual']]","Your mission, locate and free a kidnapped teenager in less than two hours. Use your Private Investigator instincts and skills to explore the area, craft items to get rid of obstacles by entering text commands.","{'PC': 'Minimum:OS *: Windows XP or laterProcessor: Intel Core I3 or equivalentMemory: 512 MB RAMGraphics: Only requires SDL supportStorage: 10 MB available spaceSound Card: Anything that can run SDL', 'Mac': '', 'Linux': ''}"
3319790,'Tactical Domination: Operation Veranite',"[['Strategy']]","Command one of three distinct factions in a fierce battle for the enigmatic resource Veranite. Utilize powerful units and strategic abilities to vie for complete supremacy. The destiny of the future lies in your hands.","{'PC': 'Minimum:Requires a 64-bit processor and operating systemOS *: Windows 7/8/10 (64-bit)Processor: Intel Core i5-2500K / AMD FX-6300 or equivalentMemory: 8 GB RAMGraphics: NVIDIA GeForce GTX 750 Ti / AMD Radeon R7 260X with 2 GB VRAM or betterDirectX: Version 11Network: Broadband Internet connectionStorage: 32 GB available spaceAdditional Notes: Mouse, Keyboard', 'Mac': 'Minimum:', 'Linux': 'Minimum:'}"
3319810,'DJMAX RESPECT V - CLEAR PASS : S14 PREMIUM TICKET',"[['Action', 'Casual', 'Sports']]","By purchasing this product, you can receive the premium product rewards for Clear Pass Season 14. Clear Pass Season 14 runs for 90 days.","{'PC': 'Minimum:Requires a 64-bit processor and operating systemOS *: Windows 7, 8.1, 10 (64bit)Processor: Intel Core 2 Duo E8400 3.0GHz AMD Athlon 64 X2 6000+ 3.0GHzMemory: 4 GB RAMGraphics: Nvidia® GTX 460 or AMD HD 5850 or betterDirectX: Version 12Network: Broadband Internet connectionStorage: 100 GB available space', 'Mac': 'Minimum:', 'Linux': 'Minimum:'}"
3319820,'DJMAX RESPECT V - CLEAR PASS : S14 CLEAR POINT BOOSTER',"[['Action', 'Casual', 'Sports']]","Buy this product to complete Clear Pass easier with below effects","{'PC': 'Minimum:Requires a 64-bit processor and operating systemOS *: Windows 7, 8.1, 10 (64bit)Processor: Intel Core 2 Duo E8400 3.0GHz AMD Athlon 64 X2 6000+ 3.0GHzMemory: 4 GB RAMGraphics: Nvidia® GTX 460 or AMD HD 5850 or betterDirectX: Version 12Network: Broadband Internet connectionStorage: 100 GB available space', 'Mac': 'Minimum:', 'Linux': 'Minimum:'}"
3319830,'The Black Knight Chronicles: The Widow without Time - Crossroads',"[['Indie', 'RPG']]","Crossover Story with &quot;Untold Tales of Citadale&quot;.","{'PC': '', 'Mac': '', 'Linux': ''}"
3319880,'DYNASTY WARRIORS: ORIGINS - Official Book & Original Soundtrack (Digital Edition)',"[['Action', 'RPG', 'Strategy']]","A digital art book containing the Official Book (Japanese) &amp; Original Soundtrack","{'PC': 'Minimum:Requires a 64-bit processor and operating system', 'Mac': 'Minimum:', 'Linux': 'Minimum:'}"
3319940,'DYNASTY WARRIORS: ORIGINS - ICHIRAN Noodles',"[['Action', 'RPG', 'Strategy', 'Free To Play']]","The portable item &quot;ICHIRAN Noodles,&quot; obtained from the Shop.","{'PC': 'Minimum:Requires a 64-bit processor and operating system', 'Mac': 'Minimum:', 'Linux': 'Minimum:'}"
3319960,'One Tap Roulette',"[['Casual', 'Simulation', 'Strategy']]","One Tap Roulette is a 1v1 multiplayer survival game of Russian roulette where every shot counts. Challenge your friends or face the world, climb the global leaderboard, outlive your oponent, but be careful : death is permanent. Are you taking the shot?","{'PC': 'Minimum:OS *: Windows 7 or higherProcessor: 1.8GHz Dual-Core CPUMemory: 4 MB RAMGraphics: Integrated GraphicsStorage: 4 GB available space', 'Mac': 'Minimum:OS: OS X 10.9.Processor: 1.8GHz Dual-Core CPUMemory: 4 GB RAMGraphics: Integrated graphicsStorage: 4 GB available space', 'Linux': ''}"
3319980,'The Legend of Heroes: Kai no Kiseki -Farewell, O Zemuria-',"[['RPG']]","The latest installment in the popular story-driven Kiseki RPG series is here! The 20th-anniversary title, The Legend of Heroes: Kai no Kiseki -Farewell, O Zemuria-, where the epic story of the continent of Zemuria takes a dramatic turn, is now available on Steam®!","{'PC': 'Minimum:Requires a 64-bit processor and operating systemOS: Windows® 10Processor: Intel® Core™ i5-3470 or AMD Ryzen™ 3 1200Memory: 8 GB RAMGraphics: GeForce GTX 1060 6 GB or AMD Radeon™ RX 580DirectX: Version 12Storage: 55 GB available spaceSound Card: Onboard', 'Mac': 'Minimum:', 'Linux': 'Minimum:'}"
3320000,'TailScape: The corgi’s Advendture',"[['Adventure', 'Indie']]","Tailscape is a Metroidvania game starring a cute puppy. Solve hidden puzzles and sometimes face large enemies to fill in the story of the bond between humans and animals.","{'PC': 'Minimum:OS: Windows 10Processor: Intel Core i5-9400FMemory: 2 GB RAMGraphics: GeForce RTX 2060Storage: 50 MB available space', 'Mac': '', 'Linux': ''}"
3320020,'Cats With Standards',"[['Adventure', 'Casual', 'Indie']]","A grotesque fever dream where cats claw through filth for bones, whisper lies to mirrors, and beg for approval from a society that purrs perfection but reeks of decay. Obey, smile, repeat—until the lines between rule and ruin blur, and you’re left meowing into the void.","{'PC': 'Minimum:OS *: Windows 7 (32-bit) or aboveProcessor: Intel Core 2 Duo E6320 (2*1866) or equivalentMemory: 2 GB RAMGraphics: GeForce 7600 GS (512 MB) or equivalentStorage: 300 MB available space', 'Mac': '', 'Linux': ''}"
3320030,'Angel Legion-DLC Anubis',"[['Adventure', 'Casual', 'Massively Multiplayer', 'RPG', 'Simulation', 'Strategy', 'Free To Play']]","Embark on your adventure with player from all over the world! Lead your Angel team to reveal the ancient mysteries of Galaxy…… Welcome to Angel legion, a free RPG gacha game with good fun!","{'PC': 'Minimum:OS: win7, win8, win10Processor: Intel Core-i3Memory: 1 GB RAMNetwork: Broadband Internet connectionStorage: 4 GB available space', 'Mac': 'Minimum:OS: macOS Mojave 10Processor: Intel Core-i3Memory: 4 GB RAMNetwork: Broadband Internet connectionStorage: 500 MB available space', 'Linux': ''}"
3320070,'Progress Knight: Multiplayer',"[['Indie', 'Massively Multiplayer', 'RPG', 'Strategy', 'Free To Play']]","An incremental multiplayer, PvP idle game","{'PC': 'Minimum:Network: Broadband Internet connection', 'Mac': '', 'Linux': ''}"
3320100,'Drowned God: Conspiracy of the Ages.',"[['Adventure']]","The original 90's Myst style Adventure Game featuring pre rendered graphics, intricate puzzle solving and step through exploration, preserved exactly as it was first released in 1996 but without the bugs! 'Extras' include the original pitch document, pre production art and loads more.","{'PC': 'Minimum:Requires a 64-bit processor and operating systemOS: Windows 10Processor: Intel PentiumMemory: 8 MB RAMGraphics: Not RequiredDirectX: Version 9.0', 'Mac': 'Minimum:', 'Linux': 'Minimum:'}"
3320120,'CRYSTAR Sakuzyo Complete Soundtrack',"[[]]","CRYSTAR Sakuzyo Complete Soundtrack","{'PC': 'Minimum:Storage: 411 MB available space', 'Mac': '', 'Linux': ''}"
